{
  "schemaVersion": 2,
  "artifactId": "site-try",
  "engineVersion": "5.0.0",
  "engineRevision": "sha256:7fb43a50459e22ea1e06b0de2cf438c9bfaaa562e244ba7233dcd1c6e5a99c43",
  "distributionIntegrity": "verified",
  "selection": {
    "agent": "codex",
    "grammar": "technical-instrument",
    "grammarSource": "built-in:technical-instrument",
    "referenceContract": null,
    "fallback": "technical-instrument",
    "adapter": "product-ui",
    "domain": "developer-tools",
    "page": "form",
    "recipe": "developer-platform",
    "recipeSelection": "developer-platform",
    "palette": "cobalt-instrument",
    "paletteSelection": "cobalt-instrument",
    "paletteGeneration": {
      "keyColor": "#0F766E",
      "mode": "light",
      "character": "balanced",
      "harmony": "auto",
      "temperature": "neutral"
    },
    "profile": "none"
  },
  "inputs": [
    {
      "id": "project",
      "path": ".styleseed/project.json",
      "sha256": "sha256:591e16ea41869e0ea997ce22abb38dd3de989329ed190e775b40c8f367734627",
      "bytes": 734
    },
    {
      "id": "artifact",
      "path": ".styleseed/artifacts/site-try.json",
      "sha256": "sha256:37424711dc73a133b2058a750230d95b3109458f860cd958922ead19f0a2cd12",
      "bytes": 1411
    }
  ],
  "sources": [
    {
      "id": "agent-execution",
      "path": "catalog:agents",
      "sha256": "sha256:7432f369c99d3d0b10a5c96d76b418b7dfbfb83e57a6b25e480f79ee86a1cd81",
      "bytes": 358
    },
    {
      "id": "core",
      "path": "catalog:core",
      "sha256": "sha256:c266458625238fc647b40eb15a80476ee116d3b8e4fbd9bee71db917f2c7a33d",
      "bytes": 8400
    },
    {
      "id": "grammar",
      "path": "built-in:technical-instrument",
      "sha256": "sha256:6afb8ea6bd57457aec17840891f72c3eb527a6bc714b2406ae42e4421a69574c",
      "bytes": 1005
    },
    {
      "id": "adapter",
      "path": "catalog:adapters/product-ui",
      "sha256": "sha256:7b5b5c34b0b235dca329e6384ccb94c66ee65a348bbe7142277ae7bbda3c13b0",
      "bytes": 714
    },
    {
      "id": "domain",
      "path": "catalog:domains/developer-tools",
      "sha256": "sha256:f7c340fa7be0cf2bf67aeb5a4fdf80eca1128a27fd5ad244eb3cecad722f45eb",
      "bytes": 1173
    },
    {
      "id": "page",
      "path": "catalog:pages/form",
      "sha256": "sha256:a04b1d73799697d460fab399ef156344c869add529cb48af7f07ae264d105996",
      "bytes": 1182
    },
    {
      "id": "recipe",
      "path": "catalog:recipes/developer-platform",
      "sha256": "sha256:69854f65ad674e20973e08c03f95aaf6fe5a794a9c6fb6f696f6a9bd57a87053",
      "bytes": 1216
    },
    {
      "id": "palette",
      "path": "catalog:palettes/cobalt-instrument",
      "sha256": "sha256:014f2d3013e1d1970400b2ba8ff67bbb325899b356673f6be7e3610811d18c2a",
      "bytes": 2257
    },
    {
      "id": "craft",
      "path": "catalog:craft",
      "sha256": "sha256:cf337a06f68960ee01e99fa734da2955fe67db990e7cda3fb1d2729acd0bd1bd",
      "bytes": 4870
    }
  ],
  "methodHash": "sha256:fcd673774e23647280042dad6733f4c398df74d15c46ccfa79e539f5e130583c",
  "validationHash": "sha256:37512c0fb793fd4e7d3ad8063c7f9be6ec9406804cb423f679dcea2c72a99504",
  "validationSlices": {
    "target": "sha256:d4a20d64ff24d4a1bacca7f947684d98e964cedf2d962c43c03b0e4bf9b6eeee",
    "implementation": "sha256:d59ce5e98f29b03291b1b26a8cb45594975ed265ef50d71e365099f41a628cd8",
    "scoreFloor": "sha256:48449a14a4ff7d79bb7a1b6f3d488eba397c36ef25634c111b49baf362511afc",
    "requiredRenders": "sha256:e2cbc22ce7be59d23cd2e88d6fdbc576aa98f69928e4ff1e61fda02e15ccca2f",
    "temporal": "sha256:c5ec5a78d8447626a8d2c39addbf2843320eb8e491b9e7c1e92927a135b06bba",
    "humanAcceptance": "sha256:fcbcf165908dd18a9e49f7ff27810176db8e9f63b4352213741664245224f8aa"
  },
  "bundle": {
    "kind": "bundle",
    "path": ".styleseed/bundles/site-try.md",
    "sha256": "sha256:c01aeb604b7870e9d5ba39e5d181b875f033412090cb76f1bbe6ad87ed5fc925",
    "bytes": 22096
  },
  "outputs": [
    {
      "kind": "bundle",
      "path": ".styleseed/bundles/site-try.md",
      "sha256": "sha256:c01aeb604b7870e9d5ba39e5d181b875f033412090cb76f1bbe6ad87ed5fc925",
      "bytes": 22096
    },
    {
      "kind": "palette-json",
      "path": ".styleseed/palettes/site-try.json",
      "sha256": "sha256:055b5ff38b591886db0fb74ce0ec47baf017df147090e2f6cd446a5500fa612e",
      "bytes": 6054
    },
    {
      "kind": "palette-css",
      "path": ".styleseed/palettes/site-try.css",
      "sha256": "sha256:0e068e77a9a959ec9587988c0bf0ec1d75b851838ff073819181f0d1ea8b5138",
      "bytes": 1157
    }
  ]
}
