{
  "schemaVersion": 2,
  "artifactId": "site-learn",
  "engineVersion": "5.0.0",
  "engineRevision": "sha256:e0581da992aa79dec04e49c6d4d9d8c265f8f22e8bc277439ed7446cb2f1e1e2",
  "distributionIntegrity": "verified",
  "selection": {
    "agent": "codex",
    "grammar": "editorial-reading",
    "grammarSource": "built-in:editorial-reading",
    "referenceContract": null,
    "fallback": "technical-instrument",
    "adapter": "product-ui",
    "domain": "developer-tools",
    "page": "detail",
    "recipe": "editorial-authority",
    "recipeSelection": "editorial-authority",
    "palette": "editorial-ink",
    "paletteSelection": "editorial-ink",
    "paletteGeneration": {
      "keyColor": "#0F766E",
      "mode": "light",
      "character": "balanced",
      "harmony": "auto",
      "temperature": "neutral"
    },
    "profile": "none"
  },
  "inputs": [
    {
      "id": "project",
      "path": ".styleseed/project.json",
      "sha256": "sha256:591e16ea41869e0ea997ce22abb38dd3de989329ed190e775b40c8f367734627",
      "bytes": 734
    },
    {
      "id": "artifact",
      "path": ".styleseed/artifacts/site-learn.json",
      "sha256": "sha256:c440c0380e4aad999b9af532f457e798b50ef86a1d2a4bb0f66bcdcaa0f3ce9c",
      "bytes": 1382
    }
  ],
  "sources": [
    {
      "id": "agent-execution",
      "path": "catalog:agents",
      "sha256": "sha256:7432f369c99d3d0b10a5c96d76b418b7dfbfb83e57a6b25e480f79ee86a1cd81",
      "bytes": 358
    },
    {
      "id": "core",
      "path": "catalog:core",
      "sha256": "sha256:c266458625238fc647b40eb15a80476ee116d3b8e4fbd9bee71db917f2c7a33d",
      "bytes": 8400
    },
    {
      "id": "grammar",
      "path": "built-in:editorial-reading",
      "sha256": "sha256:ff1f3ca417cb27454cc7d7dcf2d2b4454761b6a9d5709d4c19ad7b80faa39986",
      "bytes": 991
    },
    {
      "id": "adapter",
      "path": "catalog:adapters/product-ui",
      "sha256": "sha256:7b5b5c34b0b235dca329e6384ccb94c66ee65a348bbe7142277ae7bbda3c13b0",
      "bytes": 714
    },
    {
      "id": "domain",
      "path": "catalog:domains/developer-tools",
      "sha256": "sha256:f7c340fa7be0cf2bf67aeb5a4fdf80eca1128a27fd5ad244eb3cecad722f45eb",
      "bytes": 1173
    },
    {
      "id": "page",
      "path": "catalog:pages/detail",
      "sha256": "sha256:379a0fb01c98674ff4dc048bd107bada304c12196398637abc70dd531d569bce",
      "bytes": 910
    },
    {
      "id": "recipe",
      "path": "catalog:recipes/editorial-authority",
      "sha256": "sha256:34887c03855fa416be0f2f21581029eac8e9d51d7f58f09164352bad1e7479dc",
      "bytes": 1347
    },
    {
      "id": "palette",
      "path": "catalog:palettes/editorial-ink",
      "sha256": "sha256:99051f575b8e83ee24e5fdbb1c0cd486eebbe87a09ae9a29cc45538faa416728",
      "bytes": 2197
    },
    {
      "id": "craft",
      "path": "catalog:craft",
      "sha256": "sha256:cf337a06f68960ee01e99fa734da2955fe67db990e7cda3fb1d2729acd0bd1bd",
      "bytes": 4870
    }
  ],
  "methodHash": "sha256:aac7a7d701362c153c6c4c84592c889fb474c7870cb86e1d9b9ca87f4106633a",
  "validationHash": "sha256:5e84b491f159579a662990376c5877e339d3030a7b96c4dc8638545ed6ed0f55",
  "validationSlices": {
    "target": "sha256:73345f5db927a2a0d349f7a90d4b66bfa36695783068c2b13271c6ba67bfd0a5",
    "implementation": "sha256:211c08d9ac88d21eef20bbcc79cb30de72609b3a225bba53d8281951465977ab",
    "scoreFloor": "sha256:48449a14a4ff7d79bb7a1b6f3d488eba397c36ef25634c111b49baf362511afc",
    "requiredRenders": "sha256:e2cbc22ce7be59d23cd2e88d6fdbc576aa98f69928e4ff1e61fda02e15ccca2f",
    "temporal": "sha256:c5ec5a78d8447626a8d2c39addbf2843320eb8e491b9e7c1e92927a135b06bba",
    "humanAcceptance": "sha256:fcbcf165908dd18a9e49f7ff27810176db8e9f63b4352213741664245224f8aa"
  },
  "bundle": {
    "kind": "bundle",
    "path": ".styleseed/bundles/site-learn.md",
    "sha256": "sha256:86b8c8f0aeb8b7467ad906e2b6fd1a0047bd9ca1420a524324032774f5f7916b",
    "bytes": 21877
  },
  "outputs": [
    {
      "kind": "bundle",
      "path": ".styleseed/bundles/site-learn.md",
      "sha256": "sha256:86b8c8f0aeb8b7467ad906e2b6fd1a0047bd9ca1420a524324032774f5f7916b",
      "bytes": 21877
    },
    {
      "kind": "palette-json",
      "path": ".styleseed/palettes/site-learn.json",
      "sha256": "sha256:e90413b1e0314378626221a9ab7aa61d1308ad9eaf6ed1b5b2fc3a496ee10bef",
      "bytes": 5935
    },
    {
      "kind": "palette-css",
      "path": ".styleseed/palettes/site-learn.css",
      "sha256": "sha256:0e068e77a9a959ec9587988c0bf0ec1d75b851838ff073819181f0d1ea8b5138",
      "bytes": 1157
    }
  ]
}
