{
  "schemaVersion": 2,
  "artifactId": "project-detail",
  "engineVersion": "5.0.0",
  "engineRevision": "sha256:05d92b67570f83c3a451ba849c085e25281622c610b53bbd3281e398fa90858b",
  "distributionIntegrity": "verified",
  "selection": {
    "agent": "codex",
    "grammar": "operations-console",
    "grammarSource": "built-in:operations-console",
    "referenceContract": null,
    "fallback": "operations-console",
    "adapter": "product-ui",
    "domain": "productivity",
    "page": "detail",
    "recipe": "enterprise-workbench",
    "recipeSelection": "enterprise-workbench",
    "palette": "quiet-mineral",
    "paletteSelection": "quiet-mineral",
    "paletteGeneration": {
      "keyColor": "#17695B",
      "mode": "light",
      "character": "calm",
      "harmony": "tonal",
      "temperature": "neutral"
    },
    "profile": "none"
  },
  "inputs": [
    {
      "id": "project",
      "path": ".styleseed/project.json",
      "sha256": "sha256:9e95a73ef1a1afac613f6b8e5f118b6c5ed1e7f4f8931b4335d991939bf77f2f",
      "bytes": 749
    },
    {
      "id": "artifact",
      "path": ".styleseed/artifacts/project-detail.json",
      "sha256": "sha256:da4c03581ceeed035889ca7c94ac5e581ddc946f2e1db9aa9c53a10402a1a2b7",
      "bytes": 1287
    }
  ],
  "sources": [
    {
      "id": "agent-execution",
      "path": "catalog:agents",
      "sha256": "sha256:7432f369c99d3d0b10a5c96d76b418b7dfbfb83e57a6b25e480f79ee86a1cd81",
      "bytes": 358
    },
    {
      "id": "core",
      "path": "catalog:core",
      "sha256": "sha256:c266458625238fc647b40eb15a80476ee116d3b8e4fbd9bee71db917f2c7a33d",
      "bytes": 8400
    },
    {
      "id": "grammar",
      "path": "built-in:operations-console",
      "sha256": "sha256:618cdaf2bc6bd06f161c6c2fb1f356b2613f2bf0cd8e0e0de2575dd3bb16c382",
      "bytes": 1111
    },
    {
      "id": "adapter",
      "path": "catalog:adapters/product-ui",
      "sha256": "sha256:7b5b5c34b0b235dca329e6384ccb94c66ee65a348bbe7142277ae7bbda3c13b0",
      "bytes": 714
    },
    {
      "id": "domain",
      "path": "catalog:domains/productivity",
      "sha256": "sha256:10a1d77593a39c2653a7a862f0a7c9d9ca1ff99c234e593cf79f31dd323c5e87",
      "bytes": 1212
    },
    {
      "id": "page",
      "path": "catalog:pages/detail",
      "sha256": "sha256:379a0fb01c98674ff4dc048bd107bada304c12196398637abc70dd531d569bce",
      "bytes": 910
    },
    {
      "id": "recipe",
      "path": "catalog:recipes/enterprise-workbench",
      "sha256": "sha256:36f843c3ca4500a8944586ca6c974b7add5980e5cfd78a0dc6618468ee66b311",
      "bytes": 1434
    },
    {
      "id": "palette",
      "path": "catalog:palettes/quiet-mineral",
      "sha256": "sha256:8a90eea9401135362e9a9fdc7c8d6f984c44c2f420601e7b91f8f4f36dca58b5",
      "bytes": 2298
    },
    {
      "id": "craft",
      "path": "catalog:craft",
      "sha256": "sha256:cf337a06f68960ee01e99fa734da2955fe67db990e7cda3fb1d2729acd0bd1bd",
      "bytes": 4870
    }
  ],
  "methodHash": "sha256:e34668c42241163468ad8f2f999f9998a738ed48d2ff4267e63a257b8ef7004d",
  "validationHash": "sha256:266364af7335696bd6a09583eeb58f9078ccb73663468f3a8da6ad3fa9b2cd44",
  "validationSlices": {
    "target": "sha256:83cd0e45efa6962eef085e44ee6b1958a90a08a2a120e879aca5c5d8b395c7c0",
    "implementation": "sha256:58e1fe998c4ec61dd20ed0869d4401c795e47daa3f509cfe7d2fb1aa33b5355a",
    "scoreFloor": "sha256:48449a14a4ff7d79bb7a1b6f3d488eba397c36ef25634c111b49baf362511afc",
    "requiredRenders": "sha256:e2cbc22ce7be59d23cd2e88d6fdbc576aa98f69928e4ff1e61fda02e15ccca2f",
    "temporal": "sha256:c5ec5a78d8447626a8d2c39addbf2843320eb8e491b9e7c1e92927a135b06bba",
    "humanAcceptance": "sha256:fcbcf165908dd18a9e49f7ff27810176db8e9f63b4352213741664245224f8aa"
  },
  "bundle": {
    "kind": "bundle",
    "path": ".styleseed/bundles/project-detail.md",
    "sha256": "sha256:931f2e07785432b6c4b6c3e073c8fb58e888cbd4412790c475275ac2f66b0787",
    "bytes": 22220
  },
  "outputs": [
    {
      "kind": "bundle",
      "path": ".styleseed/bundles/project-detail.md",
      "sha256": "sha256:931f2e07785432b6c4b6c3e073c8fb58e888cbd4412790c475275ac2f66b0787",
      "bytes": 22220
    },
    {
      "kind": "palette-json",
      "path": ".styleseed/palettes/project-detail.json",
      "sha256": "sha256:f84b64a133cd1ce665a41e3957d6571333829fec8f67abf642ffd5ab41a4032b",
      "bytes": 5928
    },
    {
      "kind": "palette-css",
      "path": ".styleseed/palettes/project-detail.css",
      "sha256": "sha256:5aea2670f705b5c1e6e1f5c13f98e039970a923c473e1be9d3b17e41540882a3",
      "bytes": 1157
    }
  ]
}
