{
  "schemaVersion": 2,
  "artifactId": "site-home",
  "engineVersion": "5.0.0",
  "engineRevision": "sha256:b2c1243045676117bdd7069c10940f06cfc6b202e39dbab11891235e01d21267",
  "distributionIntegrity": "verified",
  "selection": {
    "agent": "codex",
    "grammar": "expressive-marketing",
    "grammarSource": "built-in:expressive-marketing",
    "referenceContract": null,
    "fallback": "technical-instrument",
    "adapter": "product-ui",
    "domain": "developer-tools",
    "page": "landing",
    "recipe": "expressive-brand",
    "recipeSelection": "expressive-brand",
    "palette": "signal-coral",
    "paletteSelection": "signal-coral",
    "paletteGeneration": {
      "keyColor": "#0F766E",
      "mode": "light",
      "character": "balanced",
      "harmony": "auto",
      "temperature": "neutral"
    },
    "profile": "none"
  },
  "inputs": [
    {
      "id": "project",
      "path": ".styleseed/project.json",
      "sha256": "sha256:591e16ea41869e0ea997ce22abb38dd3de989329ed190e775b40c8f367734627",
      "bytes": 734
    },
    {
      "id": "artifact",
      "path": ".styleseed/artifacts/site-home.json",
      "sha256": "sha256:c079a032c9edab357d0088361587279ffca8d4747a43328d9eeb733fce09965b",
      "bytes": 1704
    }
  ],
  "sources": [
    {
      "id": "agent-execution",
      "path": "catalog:agents",
      "sha256": "sha256:7432f369c99d3d0b10a5c96d76b418b7dfbfb83e57a6b25e480f79ee86a1cd81",
      "bytes": 358
    },
    {
      "id": "core",
      "path": "catalog:core",
      "sha256": "sha256:c266458625238fc647b40eb15a80476ee116d3b8e4fbd9bee71db917f2c7a33d",
      "bytes": 8400
    },
    {
      "id": "grammar",
      "path": "built-in:expressive-marketing",
      "sha256": "sha256:c4fbfe1dbecf6d6b5b0300dc4e4573452177464cac0d43640436acba59deae55",
      "bytes": 967
    },
    {
      "id": "adapter",
      "path": "catalog:adapters/product-ui",
      "sha256": "sha256:7b5b5c34b0b235dca329e6384ccb94c66ee65a348bbe7142277ae7bbda3c13b0",
      "bytes": 714
    },
    {
      "id": "domain",
      "path": "catalog:domains/developer-tools",
      "sha256": "sha256:f7c340fa7be0cf2bf67aeb5a4fdf80eca1128a27fd5ad244eb3cecad722f45eb",
      "bytes": 1173
    },
    {
      "id": "page",
      "path": "catalog:pages/landing",
      "sha256": "sha256:f4da394144f34d3f1aa256b9caf0320b82c4523b068bae893c92413e622c82ef",
      "bytes": 2044
    },
    {
      "id": "recipe",
      "path": "catalog:recipes/expressive-brand",
      "sha256": "sha256:95befeb0a0a3ffaecdfebde333231f33cb29052a13523c087d3b10ffc3c3be82",
      "bytes": 1984
    },
    {
      "id": "palette",
      "path": "catalog:palettes/signal-coral",
      "sha256": "sha256:2494ae377081c9d3d4be8b7ef514fa6f440296dd8c5cee58fd1665e20dafe008",
      "bytes": 2224
    },
    {
      "id": "craft",
      "path": "catalog:craft",
      "sha256": "sha256:cf337a06f68960ee01e99fa734da2955fe67db990e7cda3fb1d2729acd0bd1bd",
      "bytes": 4870
    }
  ],
  "methodHash": "sha256:0c0ac9d12fc751531f5ef61c8fa1bceadff501c270bf55b630c35fca13c3a034",
  "validationHash": "sha256:0ec7d75ee76c479b1107717acb8ae8411fdb1dfaeab57d3a8b8b3e098c7ee3de",
  "validationSlices": {
    "target": "sha256:fd89b3b7c61fa08e9a1055ecd5c5678651b23752e9a5d07d80a2fb7f5ac1ae14",
    "implementation": "sha256:b4dab1d733aad5348f824e57204e43b3618a9bff61794ff35274e9206169ad72",
    "scoreFloor": "sha256:48449a14a4ff7d79bb7a1b6f3d488eba397c36ef25634c111b49baf362511afc",
    "requiredRenders": "sha256:395fd8679a2efbe792ec8bab8b960745348a123851b6b5ca4abff4eec7c57433",
    "temporal": "sha256:44493b3e1cb087680c534ea567be974e7a8de8d6b95d5d895a1f58e404290692",
    "humanAcceptance": "sha256:fcbcf165908dd18a9e49f7ff27810176db8e9f63b4352213741664245224f8aa"
  },
  "bundle": {
    "kind": "bundle",
    "path": ".styleseed/bundles/site-home.md",
    "sha256": "sha256:49e71ce5da2ea5871984adf6829588e09d3f9b11a1b4c16e83398b1826e965e0",
    "bytes": 23651
  },
  "outputs": [
    {
      "kind": "bundle",
      "path": ".styleseed/bundles/site-home.md",
      "sha256": "sha256:49e71ce5da2ea5871984adf6829588e09d3f9b11a1b4c16e83398b1826e965e0",
      "bytes": 23651
    },
    {
      "kind": "palette-json",
      "path": ".styleseed/palettes/site-home.json",
      "sha256": "sha256:055b5ff38b591886db0fb74ce0ec47baf017df147090e2f6cd446a5500fa612e",
      "bytes": 6054
    },
    {
      "kind": "palette-css",
      "path": ".styleseed/palettes/site-home.css",
      "sha256": "sha256:0e068e77a9a959ec9587988c0bf0ec1d75b851838ff073819181f0d1ea8b5138",
      "bytes": 1157
    }
  ]
}
