{
  "schemaVersion": 2,
  "artifactId": "project-list",
  "engineVersion": "5.0.0",
  "engineRevision": "sha256:7fb43a50459e22ea1e06b0de2cf438c9bfaaa562e244ba7233dcd1c6e5a99c43",
  "distributionIntegrity": "verified",
  "selection": {
    "agent": "codex",
    "grammar": "operations-console",
    "grammarSource": "built-in:operations-console",
    "referenceContract": null,
    "fallback": "operations-console",
    "adapter": "product-ui",
    "domain": "productivity",
    "page": "list",
    "recipe": "enterprise-workbench",
    "recipeSelection": "enterprise-workbench",
    "palette": "quiet-mineral",
    "paletteSelection": "quiet-mineral",
    "paletteGeneration": {
      "keyColor": "#17695B",
      "mode": "light",
      "character": "calm",
      "harmony": "tonal",
      "temperature": "neutral"
    },
    "profile": "none"
  },
  "inputs": [
    {
      "id": "project",
      "path": ".styleseed/project.json",
      "sha256": "sha256:9e95a73ef1a1afac613f6b8e5f118b6c5ed1e7f4f8931b4335d991939bf77f2f",
      "bytes": 749
    },
    {
      "id": "artifact",
      "path": ".styleseed/artifacts/project-list.json",
      "sha256": "sha256:5c2c85807324232f2bd75a4c0c8692cd940383f613fe869b90c1f359b357a3ab",
      "bytes": 1274
    }
  ],
  "sources": [
    {
      "id": "agent-execution",
      "path": "catalog:agents",
      "sha256": "sha256:7432f369c99d3d0b10a5c96d76b418b7dfbfb83e57a6b25e480f79ee86a1cd81",
      "bytes": 358
    },
    {
      "id": "core",
      "path": "catalog:core",
      "sha256": "sha256:c266458625238fc647b40eb15a80476ee116d3b8e4fbd9bee71db917f2c7a33d",
      "bytes": 8400
    },
    {
      "id": "grammar",
      "path": "built-in:operations-console",
      "sha256": "sha256:618cdaf2bc6bd06f161c6c2fb1f356b2613f2bf0cd8e0e0de2575dd3bb16c382",
      "bytes": 1111
    },
    {
      "id": "adapter",
      "path": "catalog:adapters/product-ui",
      "sha256": "sha256:7b5b5c34b0b235dca329e6384ccb94c66ee65a348bbe7142277ae7bbda3c13b0",
      "bytes": 714
    },
    {
      "id": "domain",
      "path": "catalog:domains/productivity",
      "sha256": "sha256:10a1d77593a39c2653a7a862f0a7c9d9ca1ff99c234e593cf79f31dd323c5e87",
      "bytes": 1212
    },
    {
      "id": "page",
      "path": "catalog:pages/list",
      "sha256": "sha256:d347ce54903e7b826556118bf6a771152ad3c897ba897de14ace7b422ba7d564",
      "bytes": 851
    },
    {
      "id": "recipe",
      "path": "catalog:recipes/enterprise-workbench",
      "sha256": "sha256:36f843c3ca4500a8944586ca6c974b7add5980e5cfd78a0dc6618468ee66b311",
      "bytes": 1434
    },
    {
      "id": "palette",
      "path": "catalog:palettes/quiet-mineral",
      "sha256": "sha256:8a90eea9401135362e9a9fdc7c8d6f984c44c2f420601e7b91f8f4f36dca58b5",
      "bytes": 2298
    },
    {
      "id": "craft",
      "path": "catalog:craft",
      "sha256": "sha256:cf337a06f68960ee01e99fa734da2955fe67db990e7cda3fb1d2729acd0bd1bd",
      "bytes": 4870
    }
  ],
  "methodHash": "sha256:29593f14ce17105c89ba5000cf0c29cf933abecdada369bbfc0d7c8dfc828256",
  "validationHash": "sha256:1453a1d3443d515ce267a2c0a358a3ccc9a980a24b1d7a9bfa2d1286c9496f87",
  "validationSlices": {
    "target": "sha256:24808f1a39d7e1c28c3dac7c9e6084862e02531d5f58cf7bbe4c887a258ef4d4",
    "implementation": "sha256:58e1fe998c4ec61dd20ed0869d4401c795e47daa3f509cfe7d2fb1aa33b5355a",
    "scoreFloor": "sha256:48449a14a4ff7d79bb7a1b6f3d488eba397c36ef25634c111b49baf362511afc",
    "requiredRenders": "sha256:e2cbc22ce7be59d23cd2e88d6fdbc576aa98f69928e4ff1e61fda02e15ccca2f",
    "temporal": "sha256:c5ec5a78d8447626a8d2c39addbf2843320eb8e491b9e7c1e92927a135b06bba",
    "humanAcceptance": "sha256:fcbcf165908dd18a9e49f7ff27810176db8e9f63b4352213741664245224f8aa"
  },
  "bundle": {
    "kind": "bundle",
    "path": ".styleseed/bundles/project-list.md",
    "sha256": "sha256:b143feb0571334f198e9003b876e871e75e6d1090e0693f65419a7e691fbd7dd",
    "bytes": 22159
  },
  "outputs": [
    {
      "kind": "bundle",
      "path": ".styleseed/bundles/project-list.md",
      "sha256": "sha256:b143feb0571334f198e9003b876e871e75e6d1090e0693f65419a7e691fbd7dd",
      "bytes": 22159
    },
    {
      "kind": "palette-json",
      "path": ".styleseed/palettes/project-list.json",
      "sha256": "sha256:b25a3e8bf403ba168f8fbc5cdbf3fb5aa224f07f96bf6302f94ff47f36074cf9",
      "bytes": 6047
    },
    {
      "kind": "palette-css",
      "path": ".styleseed/palettes/project-list.css",
      "sha256": "sha256:5aea2670f705b5c1e6e1f5c13f98e039970a923c473e1be9d3b17e41540882a3",
      "bytes": 1157
    }
  ]
}
