{
  "schemaVersion": 2,
  "artifactId": "site-docs",
  "engineVersion": "5.0.0",
  "engineRevision": "sha256:7fb43a50459e22ea1e06b0de2cf438c9bfaaa562e244ba7233dcd1c6e5a99c43",
  "distributionIntegrity": "verified",
  "selection": {
    "agent": "codex",
    "grammar": "editorial-reading",
    "grammarSource": "built-in:editorial-reading",
    "referenceContract": null,
    "fallback": "technical-instrument",
    "adapter": "product-ui",
    "domain": "developer-tools",
    "page": "detail",
    "recipe": "editorial-authority",
    "recipeSelection": "editorial-authority",
    "palette": "editorial-ink",
    "paletteSelection": "editorial-ink",
    "paletteGeneration": {
      "keyColor": "#0F766E",
      "mode": "light",
      "character": "balanced",
      "harmony": "auto",
      "temperature": "neutral"
    },
    "profile": "none"
  },
  "inputs": [
    {
      "id": "project",
      "path": ".styleseed/project.json",
      "sha256": "sha256:591e16ea41869e0ea997ce22abb38dd3de989329ed190e775b40c8f367734627",
      "bytes": 734
    },
    {
      "id": "artifact",
      "path": ".styleseed/artifacts/site-docs.json",
      "sha256": "sha256:015a47ab214c53a1dbf43983c4bffb716912615e80281b23e07528a329983e77",
      "bytes": 1844
    }
  ],
  "sources": [
    {
      "id": "agent-execution",
      "path": "catalog:agents",
      "sha256": "sha256:7432f369c99d3d0b10a5c96d76b418b7dfbfb83e57a6b25e480f79ee86a1cd81",
      "bytes": 358
    },
    {
      "id": "core",
      "path": "catalog:core",
      "sha256": "sha256:c266458625238fc647b40eb15a80476ee116d3b8e4fbd9bee71db917f2c7a33d",
      "bytes": 8400
    },
    {
      "id": "grammar",
      "path": "built-in:editorial-reading",
      "sha256": "sha256:ff1f3ca417cb27454cc7d7dcf2d2b4454761b6a9d5709d4c19ad7b80faa39986",
      "bytes": 991
    },
    {
      "id": "adapter",
      "path": "catalog:adapters/product-ui",
      "sha256": "sha256:7b5b5c34b0b235dca329e6384ccb94c66ee65a348bbe7142277ae7bbda3c13b0",
      "bytes": 714
    },
    {
      "id": "domain",
      "path": "catalog:domains/developer-tools",
      "sha256": "sha256:f7c340fa7be0cf2bf67aeb5a4fdf80eca1128a27fd5ad244eb3cecad722f45eb",
      "bytes": 1173
    },
    {
      "id": "page",
      "path": "catalog:pages/detail",
      "sha256": "sha256:379a0fb01c98674ff4dc048bd107bada304c12196398637abc70dd531d569bce",
      "bytes": 910
    },
    {
      "id": "recipe",
      "path": "catalog:recipes/editorial-authority",
      "sha256": "sha256:34887c03855fa416be0f2f21581029eac8e9d51d7f58f09164352bad1e7479dc",
      "bytes": 1347
    },
    {
      "id": "palette",
      "path": "catalog:palettes/editorial-ink",
      "sha256": "sha256:99051f575b8e83ee24e5fdbb1c0cd486eebbe87a09ae9a29cc45538faa416728",
      "bytes": 2197
    },
    {
      "id": "craft",
      "path": "catalog:craft",
      "sha256": "sha256:cf337a06f68960ee01e99fa734da2955fe67db990e7cda3fb1d2729acd0bd1bd",
      "bytes": 4870
    }
  ],
  "methodHash": "sha256:309a95d2c7bb044af4a37dbb07bd149dbd2eff0bbbc7d2059be12c8d668b4ee2",
  "validationHash": "sha256:9f0db8f3a4f49d680b15bf898088c99766fc3367245a641f5ac479721fe25aea",
  "validationSlices": {
    "target": "sha256:66e3ea5ff532a9e7ac4b1f7203164a468ab2544b8069c5784b0dfeb7ff009e99",
    "implementation": "sha256:761ffdacb2012d4937f55a8e247170a68dfd57ecf926e0663cb2ed727af08791",
    "scoreFloor": "sha256:48449a14a4ff7d79bb7a1b6f3d488eba397c36ef25634c111b49baf362511afc",
    "requiredRenders": "sha256:e2cbc22ce7be59d23cd2e88d6fdbc576aa98f69928e4ff1e61fda02e15ccca2f",
    "temporal": "sha256:c5ec5a78d8447626a8d2c39addbf2843320eb8e491b9e7c1e92927a135b06bba",
    "humanAcceptance": "sha256:fcbcf165908dd18a9e49f7ff27810176db8e9f63b4352213741664245224f8aa"
  },
  "bundle": {
    "kind": "bundle",
    "path": ".styleseed/bundles/site-docs.md",
    "sha256": "sha256:28a26dbadce5b9731c45fb4fe708543a125cd4dec445dad25e3872008019047f",
    "bytes": 21877
  },
  "outputs": [
    {
      "kind": "bundle",
      "path": ".styleseed/bundles/site-docs.md",
      "sha256": "sha256:28a26dbadce5b9731c45fb4fe708543a125cd4dec445dad25e3872008019047f",
      "bytes": 21877
    },
    {
      "kind": "palette-json",
      "path": ".styleseed/palettes/site-docs.json",
      "sha256": "sha256:055b5ff38b591886db0fb74ce0ec47baf017df147090e2f6cd446a5500fa612e",
      "bytes": 6054
    },
    {
      "kind": "palette-css",
      "path": ".styleseed/palettes/site-docs.css",
      "sha256": "sha256:0e068e77a9a959ec9587988c0bf0ec1d75b851838ff073819181f0d1ea8b5138",
      "bytes": 1157
    }
  ]
}
