{
  "schemaVersion": 2,
  "artifactId": "site-gate",
  "engineVersion": "5.0.0",
  "engineRevision": "sha256:e0581da992aa79dec04e49c6d4d9d8c265f8f22e8bc277439ed7446cb2f1e1e2",
  "distributionIntegrity": "verified",
  "selection": {
    "agent": "codex",
    "grammar": "technical-instrument",
    "grammarSource": "built-in:technical-instrument",
    "referenceContract": null,
    "fallback": "technical-instrument",
    "adapter": "product-ui",
    "domain": "developer-tools",
    "page": "detail",
    "recipe": "developer-platform",
    "recipeSelection": "developer-platform",
    "palette": "cobalt-instrument",
    "paletteSelection": "cobalt-instrument",
    "paletteGeneration": {
      "keyColor": "#0F766E",
      "mode": "light",
      "character": "balanced",
      "harmony": "auto",
      "temperature": "neutral"
    },
    "profile": "none"
  },
  "inputs": [
    {
      "id": "project",
      "path": ".styleseed/project.json",
      "sha256": "sha256:591e16ea41869e0ea997ce22abb38dd3de989329ed190e775b40c8f367734627",
      "bytes": 734
    },
    {
      "id": "artifact",
      "path": ".styleseed/artifacts/site-gate.json",
      "sha256": "sha256:9a44b2b0028887a226b650471c8a0184dc692cbaa8e265a66e1363562f1365b9",
      "bytes": 1412
    }
  ],
  "sources": [
    {
      "id": "agent-execution",
      "path": "catalog:agents",
      "sha256": "sha256:7432f369c99d3d0b10a5c96d76b418b7dfbfb83e57a6b25e480f79ee86a1cd81",
      "bytes": 358
    },
    {
      "id": "core",
      "path": "catalog:core",
      "sha256": "sha256:c266458625238fc647b40eb15a80476ee116d3b8e4fbd9bee71db917f2c7a33d",
      "bytes": 8400
    },
    {
      "id": "grammar",
      "path": "built-in:technical-instrument",
      "sha256": "sha256:6afb8ea6bd57457aec17840891f72c3eb527a6bc714b2406ae42e4421a69574c",
      "bytes": 1005
    },
    {
      "id": "adapter",
      "path": "catalog:adapters/product-ui",
      "sha256": "sha256:7b5b5c34b0b235dca329e6384ccb94c66ee65a348bbe7142277ae7bbda3c13b0",
      "bytes": 714
    },
    {
      "id": "domain",
      "path": "catalog:domains/developer-tools",
      "sha256": "sha256:f7c340fa7be0cf2bf67aeb5a4fdf80eca1128a27fd5ad244eb3cecad722f45eb",
      "bytes": 1173
    },
    {
      "id": "page",
      "path": "catalog:pages/detail",
      "sha256": "sha256:379a0fb01c98674ff4dc048bd107bada304c12196398637abc70dd531d569bce",
      "bytes": 910
    },
    {
      "id": "recipe",
      "path": "catalog:recipes/developer-platform",
      "sha256": "sha256:69854f65ad674e20973e08c03f95aaf6fe5a794a9c6fb6f696f6a9bd57a87053",
      "bytes": 1216
    },
    {
      "id": "palette",
      "path": "catalog:palettes/cobalt-instrument",
      "sha256": "sha256:014f2d3013e1d1970400b2ba8ff67bbb325899b356673f6be7e3610811d18c2a",
      "bytes": 2257
    },
    {
      "id": "craft",
      "path": "catalog:craft",
      "sha256": "sha256:cf337a06f68960ee01e99fa734da2955fe67db990e7cda3fb1d2729acd0bd1bd",
      "bytes": 4870
    }
  ],
  "methodHash": "sha256:65fce859395926f1bffdbe8ad8b94258df6d6daafd6582d781e00905885188d2",
  "validationHash": "sha256:3462a1922e141bcb82dfd875e886dc8aae43a995ce0bc7958705594a9cf20e0c",
  "validationSlices": {
    "target": "sha256:8526c1b937ff04eca5240f675e31614b0d3d02eed712d32e98b6c1f569498f74",
    "implementation": "sha256:44949fd5e91426cb7cac8caea3651631b537946e5e98df569aebbe03ebd1b855",
    "scoreFloor": "sha256:48449a14a4ff7d79bb7a1b6f3d488eba397c36ef25634c111b49baf362511afc",
    "requiredRenders": "sha256:e2cbc22ce7be59d23cd2e88d6fdbc576aa98f69928e4ff1e61fda02e15ccca2f",
    "temporal": "sha256:c5ec5a78d8447626a8d2c39addbf2843320eb8e491b9e7c1e92927a135b06bba",
    "humanAcceptance": "sha256:fcbcf165908dd18a9e49f7ff27810176db8e9f63b4352213741664245224f8aa"
  },
  "bundle": {
    "kind": "bundle",
    "path": ".styleseed/bundles/site-gate.md",
    "sha256": "sha256:fca62fe3c46c239ce9a9ae2ee77283aad7160716923f6cc6587e31fbd295ae25",
    "bytes": 21826
  },
  "outputs": [
    {
      "kind": "bundle",
      "path": ".styleseed/bundles/site-gate.md",
      "sha256": "sha256:fca62fe3c46c239ce9a9ae2ee77283aad7160716923f6cc6587e31fbd295ae25",
      "bytes": 21826
    },
    {
      "kind": "palette-json",
      "path": ".styleseed/palettes/site-gate.json",
      "sha256": "sha256:e90413b1e0314378626221a9ab7aa61d1308ad9eaf6ed1b5b2fc3a496ee10bef",
      "bytes": 5935
    },
    {
      "kind": "palette-css",
      "path": ".styleseed/palettes/site-gate.css",
      "sha256": "sha256:0e068e77a9a959ec9587988c0bf0ec1d75b851838ff073819181f0d1ea8b5138",
      "bytes": 1157
    }
  ]
}
